19_1	What is chemical energy?	What is chemical energy?
19_2	Describe a chemical reaction.	Describe a chemical reaction.
19_3	How is it represented mathematically?	How is chemical energy represented mathematically?
19_4	Give me an example.	Give me an example.
19_5	What are the different kinds of reactions?	What are the different kinds of reactions?
19_6	What is a decomposition reaction?	What is a decomposition reaction?
19_7	How is it a chemical change?	How is a decomposition reaction a chemical change?
19_8	What is a synthesis reaction?	What is a synthesis reaction?
19_9	Tell me the differences between synthesis and decomposition.	Tell me the differences between synthesis and decomposition.
