20_1	Describe cell membranes.	Describe cell membranes.
20_2	What are its important functions?	What are its important functions?
20_3	Tell me about the phospholipid bilayer.	Tell me about the phospholipid bilayer.
20_4	What are its functions?	What are the phospholipid bilayer's functions?
20_5	What if the membrane gets damaged?	What if the membrane gets damaged?
20_6	Do they repair themselves?	Do the membrane repair the membrane?
20_7	Which nutrients may help in the repair process?	Which nutrients may help in the repair process?
