26_1	What defines a chemical element?	What defines a chemical element?
26_2	How are they related to the Periodic Table?	How are a chemical element related to the Periodic Table?
26_3	How is it organised?	How is the Periodic Table organised?
26_4	How does a chemical compound differ from an element?	How does a chemical compound differ from an element?
26_5	What are different types of compounds?	What are different types of compounds?
26_6	How are they formed?	How are compounds formed?
26_7	Which ones are important for the human body?	Which ones are important for the human body?
26_8	What are important ones used on a daily basis?	What are important ones used on a daily basis?
