27_1	What comprises a balanced diet?	What comprises a balanced diet?
27_2	Is it the same for men as well as women?	Is it the same for men as well as women?
27_3	What are some specific recommendations for women?	What are some specific recommendations for women?
27_4	Are dairy products necessary for a good health?	Are dairy products necessary for a good health?
27_5	Can it harm you instead?	Can dairy products harm you instead?
27_6	How necessary is fiber?	How necessary is fiber?
27_7	What happens if it's consumed in a smaller amount than recommended?	What happens if fiber's consumed in a smaller amount than recommended?
