45_1	What dog breed is the best for playing?	What dog breed is the best for playing?
45_2	What kind should I get if I’m allergic?	What kind should I get if I’m allergic?
45_3	How about big and active dogs?	How about big and active dogs?
45_4	Do big dogs live longer than small dogs?	Do big dogs live longer than small dogs?
45_5	Will I need to put a lot of time into training?	Will I need to put a lot of time into training?
45_6	Tell me about some breeds that are independent and can be left home all day.	Tell I about some breeds that are independent and can be left home all day.
45_7	How much does a Irish Wolfhound weigh?	How much does a Irish Wolfhound weigh?
45_8	How much do they cost?	How much do a Irish Wolfhound cost?
