48_1	What is the main function of a virtual machine?	What is the main function of a virtual machine?
48_2	What are its advantages?	What are a virtual machine's advantages?
48_3	Describe some of its disadvantages.	Describe some of a virtual machine's disadvantages.
48_4	How do they work?	How do a virtual machine work?
48_5	What are the main types of VMs?	What are the main types of VMs?
48_6	What is their role in cloud computing?	What is VMs's role in cloud computing?
48_7	How is a container different?	How is a container different?
48_8	What is the advantage of Docker?	What is the advantage of Docker?
48_9	How is it related Kurbenetes?	How is Docker related Kurbenetes?
