53_1	Is Red Bull bad for you?	Is Red Bull bad for you?
53_2	Can it kill you?	Can Red Bull kill you?
53_3	How much can you drink in a day?	How much can you drink in a day?
53_4	What is taurine?	What is taurine?
53_5	What are its health effects?	What are taurine's health effects?
53_6	In general, what are the effects of consuming energy drinks?	In general, what are the effects of consuming energy drinks?
53_7	Why are they harmful when mixed with alcohol?	Why are energy drinks harmful when mixed with alcohol?
53_8	What is the argument for their age restriction to kids?	What is the argument for energy drinks's age restriction to kids?
53_9	Where are they banned to minors?	Where are energy drinks banned to minors?
