9_1	Why is statistics important?	Why is statistics important?
9_2	Why should one study it?	Why should one study statistics?
9_3	Tell me about its career options.	Tell me about statistics's career options.
9_4	Are Data Scientists in high demand?	Are Data Scientists in high demand?
9_5	How much do they make on average in a year?	How much do Data Scientists make on average in a year?
9_6	What is range in statistics?	What is range in statistics?
9_7	Describe some different metrics to interpret it.	Describe some different metrics to interpret statistics.
9_8	What are quartiles?	What are quartiles?
9_9	How do you find the lower and upper quartile?	How do you find the lower and upper quartile?
